{
  "service": "model-runtime",
  "runtime_version": "0.7.7",
  "supported_contract_versions": [
    1
  ],
  "backend": "fake",
  "loaded": [
    "r1"
  ],
  "serving_config_hash": {
    "LORA_A": "sha256:0e487c9c100bac46c66b425b5971cdb43948b4c9dcde0df14651e9108163fc6a",
    "LORA_B": "sha256:0e487c9c100bac46c66b425b5971cdb43948b4c9dcde0df14651e9108163fc6a"
  },
  "system_prompt_sha256": {
    "LORA_A": "sha256:4d6e0bcc1b687b6bb24acda8bcfa126695046c26dd0fb91aa7c653ff56154ce9",
    "LORA_B": "sha256:9834d60d932f46226a5d8cabe13f58ba30b3ac5ec63d74968d499beb675a4655"
  },
  "serving_config_expectation": {
    "constraint": {
      "backend": "fake",
      "backend_version": "1",
      "supported_features": [
        "$defs",
        "$ref",
        "additionalProperties",
        "anyOf",
        "enum",
        "items",
        "properties",
        "required",
        "type"
      ],
      "relax_policy_version": "relax-3"
    },
    "prompt_template_versions": [
      "prompt-4"
    ],
    "prompt_template_version_default": "prompt-4",
    "deprecated_prompt_template_versions": [],
    "protection_policy_versions": [
      "protect-2"
    ],
    "output_contract": 1
  },
  "test_hooks": {}
}
